abstract,results,authors,title
"Broadly reactive antibodies that target sequence-diverse antigens are of interest for vaccine design and monoclonal antibody therapeutic development because they can protect against multiple strains of a virus and provide a barrier to evolution of escape mutants. Using LIBRA-seq (linking B cell receptor to antigen specificity through sequencing) data for the B cell repertoire of an individual chronically infected with human immunodeficiency virus type 1 (HIV-1), we identified a lineage of IgG3 antibodies predicted to bind to HIV-1 Envelope (Env) and influenza A Hemagglutinin (HA). Two lineage members, antibodies 2526 and 546, were confirmed to bind to a large panel of diverse antigens, including several strains of HIV-1 Env, influenza HA, coronavirus (CoV) spike, hepatitis C virus (HCV) E protein, Nipah virus (NiV) F protein, and Langya virus (LayV) F protein. We found that both antibodies bind to complex glycans on the antigenic surfaces. Antibody 2526 targets the stem region of influenza HA and the N-terminal domain (NTD) region of SARS-CoV-2 spike. A crystal structure of 2526 Fab bound to mannose revealed the presence of a glycan-binding pocket on the light chain. Antibody 2526 cross-reacted with antigens from multiple pathogens and displayed no signs of autoreactivity. These features distinguish antibody 2526 from previously described glycan-reactive antibodies. Further study of this antibody class may aid in the selection and engineering of broadly reactive antibody therapeutics and can inform the development of effective vaccines with exceptional breadth of pathogen coverage.",,"[{'lastname': 'Vukovich', 'firstname': 'Matthew J', 'initials': 'MJ', 'affiliation': 'Vanderbilt Vaccine Center, Vanderbilt University Medical Center, Nashville, Tennessee, United States of America.\nDepartment of Pathology, Microbiology and Immunology, Vanderbilt University Medical Center, Nashville, Tennessee, United States of America.'}, {'lastname': 'Shiakolas', 'firstname': 'Andrea R', 'initials': 'AR', 'affiliation': 'Vanderbilt Vaccine Center, Vanderbilt University Medical Center, Nashville, Tennessee, United States of America.\nDepartment of Pathology, Microbiology and Immunology, Vanderbilt University Medical Center, Nashville, Tennessee, United States of America.'}, {'lastname': 'Lindenberger', 'firstname': 'Jared', 'initials': 'J', 'affiliation': 'Duke Human Vaccine Institute, Durham, North Carolina, United States of America.'}, {'lastname': 'Richardson', 'firstname': 'Robert A', 'initials': 'RA', 'affiliation': 'Florida Research and Innovation Center, Cleveland Clinic, Port Saint Lucie, Florida, United States of America.\nCenter for Vaccines and Immunology, University of Georgia, Athens, Georgia, United States of America.'}, {'lastname': 'Bass', 'firstname': 'Lindsay E', 'initials': 'LE', 'affiliation': 'Department of Pathology, Microbiology and Immunology, Vanderbilt University Medical Center, Nashville, Tennessee, United States of America.'}, {'lastname': 'Barr', 'firstname': 'Maggie', 'initials': 'M', 'affiliation': 'Duke Human Vaccine Institute, Durham, North Carolina, United States of America.'}, {'lastname': 'Liu', 'firstname': 'Yanshun', 'initials': 'Y', 'affiliation': 'Duke Human Vaccine Institute, Durham, North Carolina, United States of America.'}, {'lastname': 'Go', 'firstname': 'Eden P', 'initials': 'EP', 'affiliation': 'Department of Chemistry, University of Kansas, Lawrence, Kansas, United States of America.'}, {'lastname': 'Park', 'firstname': 'Chan Soo', 'initials': 'CS', 'affiliation': 'Duke Human Vaccine Institute, Durham, North Carolina, United States of America.'}, {'lastname': 'May', 'firstname': 'Aaron J', 'initials': 'AJ', 'affiliation': 'Duke Human Vaccine Institute, Durham, North Carolina, United States of America.\nDepartment of Biochemistry, Duke University School of Medicine, Durham, North Carolina, United States of America.'}, {'lastname': 'Sammour', 'firstname': 'Salam', 'initials': 'S', 'affiliation': 'Duke Human Vaccine Institute, Durham, North Carolina, United States of America.'}, {'lastname': 'Kambarami', 'firstname': 'Chipo', 'initials': 'C', 'affiliation': 'Duke Human Vaccine Institute, Durham, North Carolina, United States of America.'}, {'lastname': 'Huang', 'firstname': 'Xiao', 'initials': 'X', 'affiliation': 'Duke Human Vaccine Institute, Durham, North Carolina, United States of America.'}, {'lastname': 'Janowska', 'firstname': 'Katarzyna', 'initials': 'K', 'affiliation': 'Duke Human Vaccine Institute, Durham, North Carolina, United States of America.'}, {'lastname': 'Edwards', 'firstname': 'Robert J', 'initials': 'RJ', 'affiliation': 'Duke Human Vaccine Institute, Durham, North Carolina, United States of America.'}, {'lastname': 'Mansouri', 'firstname': 'Katayoun', 'initials': 'K', 'affiliation': 'Duke Human Vaccine Institute, Durham, North Carolina, United States of America.'}, {'lastname': 'Spence', 'firstname': 'Taylor N', 'initials': 'TN', 'affiliation': 'Duke Human Vaccine Institute, Durham, North Carolina, United States of America.'}, {'lastname': 'Abu-Shmais', 'firstname': 'Alexandra A', 'initials': 'AA', 'affiliation': 'Vanderbilt Vaccine Center, Vanderbilt University Medical Center, Nashville, Tennessee, United States of America.\nDepartment of Pathology, Microbiology and Immunology, Vanderbilt University Medical Center, Nashville, Tennessee, United States of America.'}, {'lastname': 'Manamela', 'firstname': 'Nelia P', 'initials': 'NP', 'affiliation': 'MRC Antibody Immunity Research Unit, School of Pathology, University of the Witwatersrand, Johannesburg, South Africa.\nNational Institute for Communicable Diseases of the National Health Laboratory Service, Johannesburg, South Africa.'}, {'lastname': 'Richardson', 'firstname': 'Simone I', 'initials': 'SI', 'affiliation': 'MRC Antibody Immunity Research Unit, School of Pathology, University of the Witwatersrand, Johannesburg, South Africa.\nNational Institute for Communicable Diseases of the National Health Laboratory Service, Johannesburg, South Africa.'}, {'lastname': 'Leonard', 'firstname': 'Sabina E W', 'initials': 'SEW', 'affiliation': 'Vanderbilt Vaccine Center, Vanderbilt University Medical Center, Nashville, Tennessee, United States of America.\nDepartment of Pathology, Microbiology and Immunology, Vanderbilt University Medical Center, Nashville, Tennessee, United States of America.'}, {'lastname': 'Gripenstraw', 'firstname': 'Kathryn R', 'initials': 'KR', 'affiliation': 'Vanderbilt Vaccine Center, Vanderbilt University Medical Center, Nashville, Tennessee, United States of America.'}, {'lastname': 'Setliff', 'firstname': 'Ian', 'initials': 'I', 'affiliation': 'Vanderbilt Vaccine Center, Vanderbilt University Medical Center, Nashville, Tennessee, United States of America.\nProgram in Chemical and Physical Biology, Vanderbilt University Medical Center, Nashville, Tennessee, United States of America.'}, {'lastname': 'Saunders', 'firstname': 'Kevin O', 'initials': 'KO', 'affiliation': 'Duke Human Vaccine Institute, Durham, North Carolina, United States of America.'}, {'lastname': 'Bonami', 'firstname': 'Rachel H', 'initials': 'RH', 'affiliation': 'Department of Pathology, Microbiology and Immunology, Vanderbilt University Medical Center, Nashville, Tennessee, United States of America.\nDivision of Rheumatology and Immunology, Department of Medicine, Vanderbilt University Medical Center, Nashville, Tennessee, United States of America.\nVanderbilt Center for Immunobiology, Vanderbilt University Medical Center, Nashville, Tennessee, United States of America.\nVanderbilt Institute for Infection, Immunology and Inflammation, Vanderbilt University Medical Center, Nashville, Tennessee, United States of America.'}, {'lastname': 'Ross', 'firstname': 'Ted M', 'initials': 'TM', 'affiliation': 'Florida Research and Innovation Center, Cleveland Clinic, Port Saint Lucie, Florida, United States of America.\nCenter for Vaccines and Immunology, University of Georgia, Athens, Georgia, United States of America.\nDepartment of Infectious Diseases, University of Georgia, Athens, Georgia, United States of America.'}, {'lastname': 'Desaire', 'firstname': 'Heather', 'initials': 'H', 'affiliation': 'Department of Chemistry, University of Kansas, Lawrence, Kansas, United States of America.'}, {'lastname': 'Moore', 'firstname': 'Penny L', 'initials': 'PL', 'affiliation': 'MRC Antibody Immunity Research Unit, School of Pathology, University of the Witwatersrand, Johannesburg, South Africa.\nNational Institute for Communicable Diseases of the National Health Laboratory Service, Johannesburg, South Africa.'}, {'lastname': 'Parks', 'firstname': 'Robert', 'initials': 'R', 'affiliation': 'Duke Human Vaccine Institute, Durham, North Carolina, United States of America.'}, {'lastname': 'Haynes', 'firstname': 'Barton F', 'initials': 'BF', 'affiliation': 'Duke Human Vaccine Institute, Durham, North Carolina, United States of America.\nDepartment of Medicine and Immunology, Duke University School of Medicine, Durham, North Carolina, United States of America.'}, {'lastname': 'Sheward', 'firstname': 'Daniel J', 'initials': 'DJ', 'affiliation': 'Department of Microbiology, Tumor and Cell Biology, Karolinska Institutet, Stockholm, Sweden.'}, {'lastname': 'Acharya', 'firstname': 'Priyamvada', 'initials': 'P', 'affiliation': 'Duke Human Vaccine Institute, Durham, North Carolina, United States of America.\nDepartment of Biochemistry, Duke University School of Medicine, Durham, North Carolina, United States of America.\nDepartment of Surgery, Duke University School of Medicine, Durham, North Carolina, United States of America.'}, {'lastname': 'Sautto', 'firstname': 'Giuseppe A', 'initials': 'GA', 'affiliation': 'Florida Research and Innovation Center, Cleveland Clinic, Port Saint Lucie, Florida, United States of America.\nCenter for Vaccines and Immunology, University of Georgia, Athens, Georgia, United States of America.'}, {'lastname': 'Georgiev', 'firstname': 'Ivelin S', 'initials': 'IS', 'affiliation': 'Vanderbilt Vaccine Center, Vanderbilt University Medical Center, Nashville, Tennessee, United States of America.\nDepartment of Pathology, Microbiology and Immunology, Vanderbilt University Medical Center, Nashville, Tennessee, United States of America.\nProgram in Chemical and Physical Biology, Vanderbilt University Medical Center, Nashville, Tennessee, United States of America.\nVanderbilt Institute for Infection, Immunology and Inflammation, Vanderbilt University Medical Center, Nashville, Tennessee, United States of America.\nDepartment of Computer Science, Vanderbilt University, Nashville, Tennessee, United States of America.\nCenter for Structural Biology, Vanderbilt University, Nashville, Tennessee, United States of America.\nProgram in Computational Microbiology and Immunology, Vanderbilt University Medical Center, Nashville, Tennessee, United States of America.'}]",Isolation and characterization of IgG3 glycan-targeting antibodies with exceptional cross-reactivity for diverse viral families.
"Sexually transmitted infections are a significant, and growing, public health problem in this country - particularly among youth. Innovative strategies are needed to reduce the community burden of infection. Preliminary studies indicate that individuals involved in the criminal legal system have high rates of infection. While gaps exist in providing screening for incarcerated individuals, there are minimal efforts that have been initiated to screen individuals diverted from incarceration. In this study, we examined the STI risk profile and feasibility of screening for sexually transmitted infections for youth who were attending an alternative sentencing program after arrest for a minor offense. Youth were screened for chlamydia and gonorrhea using urine-based nucleic acid amplification tests.
Of the 307 participants engaged in a program providing supportive services for criminal legal system involved youth at the Brooklyn Court House in New York City, 186 agreed to screening for sexually transmitted infections, and 8% were positive for chlamydia, gonorrhea, or both.
Screening programs within carceral settings have proven effective in identifying individuals with STIs. However, with policy changes diverting more young people away from incarceration and into community-based programs, innovative programs are needed to identify STIs among youth in these settings. Our findings indicate that it is feasible to conduct venue-based screening in these settings, and, doing so may identify youth in need of treatment and further evaluation.","Of the 307 participants engaged in a program providing supportive services for criminal legal system involved youth at the Brooklyn Court House in New York City, 186 agreed to screening for sexually transmitted infections, and 8% were positive for chlamydia, gonorrhea, or both.","[{'lastname': 'Cohall', 'firstname': 'Alwyn', 'initials': 'A', 'affiliation': 'Columbia University Mailman School of Public Health, New York, USA. Atc1@cumc.columbia.edu.\nColumbia University Irving Medical Center, New York, USA. Atc1@cumc.columbia.edu.'}, {'lastname': 'Cohall', 'firstname': 'Renee', 'initials': 'R', 'affiliation': 'Columbia University Mailman School of Public Health, New York, USA.'}, {'lastname': 'Staeheli', 'firstname': 'Laura', 'initials': 'L', 'affiliation': 'Columbia University Mailman School of Public Health, New York, USA.'}, {'lastname': 'Dolezal', 'firstname': 'Curtis', 'initials': 'C', 'affiliation': 'New York State Psychiatric Institute, New York, USA.'}, {'lastname': 'Campos', 'firstname': 'Stephanie', 'initials': 'S', 'affiliation': 'New York State Psychiatric Institute, New York, USA.'}, {'lastname': 'Lee', 'firstname': 'Sin', 'initials': 'S', 'affiliation': 'New York State Psychiatric Institute, New York, USA.'}, {'lastname': ""O'Grady"", 'firstname': 'Megan', 'initials': 'M', 'affiliation': 'University of Connecticut, Storrs, USA.'}, {'lastname': 'Tross', 'firstname': 'Susan', 'initials': 'S', 'affiliation': 'New York State Psychiatric Institute, New York, USA.'}, {'lastname': 'Wilson', 'firstname': 'Patrick', 'initials': 'P', 'affiliation': 'University of California, Los Angeles, USA.'}, {'lastname': 'Elkington', 'firstname': 'Katherine', 'initials': 'K', 'affiliation': 'New York State Psychiatric Institute, New York, USA.'}]",Screening for STIs among criminal legal system involved youth of color in community settings.
"Humanitarian crises-natural or human-made events that can threaten communities' health, safety, security, and well-being-may affect the HIV epidemic dynamics. Common aspects of humanitarian crises such as poverty, powerlessness, disruptions to the health systems, and social instability can contribute to a person's vulnerability to HIV infection through increased risk behaviors and limited access to health services. Guided by the Joanna Briggs Institute methodology for scoping reviews and the Preferred Reporting Items for Systematic Reviews and Meta-Analysis extension for Scoping Reviews (PRISMA-ScR) reporting guidelines, we conducted a scoping review of literature published in English between January 1990 and March 2022 to characterize the global evidence of modifiable and non-modifiable factors for HIV acquisition in the context of humanitarian crises. We systematically searched, screened, and synthesized literature from MEDLINE, Embase, Global Health (all accessed via Ovid), and Scopus, and also grey literature through websites of humanitarian agencies and relevant non-government organizations, the International AIDS Society's abstract databases, and Google Scholar. We considered studies presenting empirical data on HIV prevalence, incidence, or risk factors in humanitarian crises-affected populations, including refugees, asylum seekers, and internally displaced persons. Forty-nine studies met the inclusion criteria. The majority of studies were quantitative (n = 43, 87.8%) and cross-sectional (n = 37, 75.5%) in design. Most were single-country studies (n = 43, 87.8%) and conducted in Sub-Saharan Africa (n = 31, 63.3%). We identified 5 non-modifiable factors for HIV acquisition (i.e., age, gender, location, place of birth or origin, and ethnicity) and 60 modifiable factors that we further classified into five categories, namely 18 policy and structural, 9 sociocultural, 11 health and mental health, 16 sexual practice, and 6 humanitarian crisis-related traumatic event factors. Within the modifiable categories, factors that were most often investigated were education level, marital status, sexually transmitted infection diagnosis, condom use, and experience of rape or sexual trauma, respectively. Informed by the findings, we applied the social-ecological model to map the identified multidimensional factors associated with HIV acquisition at the levels of individual, social and sexual networks, community, public policy, and the context of humanitarian crises. The current review provides a comprehensive, global analysis of the available evidence on HIV prevalence, incidence, and risk factors in humanitarian crises and implications for potential programs and research. Future research is warranted to further understand the directionality of the non-modifiable and modifiable factors affecting HIV acquisition, and the multilevel barriers and facilitators to the uptake of HIV prevention strategies in the context of humanitarian crises. Such research can generate actionable evidence to inform the development of ethical, trauma-informed, and culturally appropriate HIV prevention interventions in humanitarian settings.
Las crisis humanitarias (eventos naturales o provocados por el hombre que pueden amenazar la salud, la seguridad y el bienestar de las comunidades) pueden afectar la dinámica de la epidemia del VIH. Los aspectos comunes de las crisis humanitarias como la pobreza, la impotencia, las perturbaciones de los sistemas de salud y la inestabilidad social pueden contribuir a la vulnerabilidad de una persona a la infección por VIH a través del aumento de comportamientos de riesgo y el acceso limitado a los servicios de salud. Guiados por la metodología del Instituto Joanna Briggs para las revisiones de alcance y la extensión de las directrices para la presentación de elementos de informe preferidos para revisiones sistemáticas y metaanálisis para revisiones de alcance (PRISMA-ScR), llevamos a cabo una revisión de alcance de la literatura publicada en inglés entre enero de 1990 y marzo de 2022 para caracterizar la evidencia global de factores modificables y no modificables para la adquisición del VIH en el contexto de crisis humanitarias. Buscamos, seleccionamos y sintetizamos sistemáticamente literatura de MEDLINE, Embase, Global Health (todas accedidas a través de Ovid) y Scopus y literatura gris a través de sitios web de agencias humanitarias y organizaciones no gubernamentales relevantes, las bases de datos de resúmenes de la Sociedad Internacional del SIDA y Google Académico. Consideramos estudios que presentaban datos empíricos sobre la prevalencia, incidencia o factores de riesgo del VIH en poblaciones afectadas por crisis humanitarias, incluyendo las personas refugiadas, solicitantes de asilo y desplazadas internamente. Cuarenta y nueve estudios cumplieron los criterios de inclusión. La mayoría de los estudios fueron de diseño cuantitativo (n = 43, 87.8%) y transversal (n = 37, 75.5%). La mayoría fueron estudios de un solo país (n = 43, 87.8%) y realizados en África subsahariana (n = 31, 63.3%). Identificamos cinco factores no modificables para la adquisición del VIH (es decir, edad, género, ubicación geográfica, lugar de nacimiento u origen y grupo étnico) y 60 factores modificables que clasificamos en cinco categorías, a saber 18 políticos y estructurales, 9 socioculturales, 11 factores de salud y salud mental, 16 de práctica sexual y 6 de eventos traumáticos relacionados con crisis humanitarias. Dentro de las categorías modificables, los factores que se investigaron con mayor frecuencia fueron el nivel educativo, el estado civil, el diagnóstico de infecciones de transmisión sexual, el uso de condón y la experiencia de violación o trauma sexual, respectivamente. Informados por los hallazgos, aplicamos el modelo socioecológico para asignar los factores multidimensionales asociados con la adquisición del VIH identificados a los niveles individual, de redes sociales y sexuales, comunidad, políticas públicas y contexto de crisis humanitaria. La revisión presente proporciona un análisis integral y global de la evidencia disponible sobre la prevalencia, la incidencia y los factores de riesgo del VIH en crisis humanitarias y sus implicaciones para posibles programas e investigaciones. Se necesitan más investigaciones para comprender mejor la direccionalidad de los factores modificables y no modificables que afectan la adquisición de VIH, y las barreras y facilitadores multinivel para el uso de estrategias para la prevención del VIH en el contexto de las crisis humanitarias. Dicha investigación puede generar evidencia accionable para informar el desarrollo de intervenciones para la prevención del VIH que sean éticas, informadas sobre el trauma, y culturalmente apropiadas en entornos humanitarios.",,"[{'lastname': 'Harsono', 'firstname': 'Dini', 'initials': 'D', 'affiliation': 'Center for Interdisciplinary Research on AIDS, Yale School of Public Health, 135 College St, Suite 200, New Haven, CT, 06510, USA. dini.harsono@yale.edu.'}, {'lastname': 'Atre', 'firstname': 'Swarali', 'initials': 'S', 'affiliation': 'Department of Chronic Disease Epidemiology, Yale School of Public Health, Yale University, New Haven, CT, USA.'}, {'lastname': 'Peterson', 'firstname': 'Hanna', 'initials': 'H', 'affiliation': 'Department of Epidemiology of Microbial Diseases, Yale School of Public Health, Yale University, New Haven, CT, USA.\nManagement Sciences for Health, Arlington, VA, USA.'}, {'lastname': 'Nyhan', 'firstname': 'Kate', 'initials': 'K', 'affiliation': 'Harvey Cushing/John Hay Whitney Medical Library, Yale University, New Haven, CT, USA.\nDepartment of Environmental Health Sciences, Yale School of Public Health, Yale University, New Haven, CT, USA.'}, {'lastname': 'Garmroudi', 'firstname': 'Dina', 'initials': 'D', 'affiliation': 'Department of Chronic Disease Epidemiology, Yale School of Public Health, Yale University, New Haven, CT, USA.'}, {'lastname': 'Davis', 'firstname': 'J Lucian', 'initials': 'JL', 'affiliation': 'Center for Interdisciplinary Research on AIDS, Yale School of Public Health, 135 College St, Suite 200, New Haven, CT, 06510, USA.\nDepartment of Epidemiology of Microbial Diseases, Yale School of Public Health, Yale University, New Haven, CT, USA.\nDepartment of Pulmonary, Critical Care and Sleep Medicine, Yale School of Medicine, Yale University, New Haven, CT, USA.'}, {'lastname': 'Ho', 'firstname': 'Winnie', 'initials': 'W', 'affiliation': 'Department of Social and Behavioral Sciences, Yale School of Public Health, Yale University, New Haven, CT, USA.'}, {'lastname': 'Khoshnood', 'firstname': 'Kaveh', 'initials': 'K', 'affiliation': 'Center for Interdisciplinary Research on AIDS, Yale School of Public Health, 135 College St, Suite 200, New Haven, CT, 06510, USA.\nDepartment of Epidemiology of Microbial Diseases, Yale School of Public Health, Yale University, New Haven, CT, USA.'}]",A Scoping Review of Factors Associated with HIV Acquisition in the Context of Humanitarian Crises.
