abstract,results,authors,title
"Antiretroviral therapy (ART) for HIV infection has evolved substantially. The development of long-acting drugs, such as cabotegravir (CAB) and rilpivirine (RPV) might improve treatment satisfaction among people living with HIV (PLWH). The real-world effectiveness of long-acting ART and its effect on patient satisfaction needs to be assessed. This study investigated antiviral effectiveness and treatment satisfaction in PLWH who switched from conventional to long-acting ART (CAB + RPV).
This prospective cohort study included PLWH aged 18 years and older who switched to CAB + RPV and received the injections every 8 weeks between June 2022 and May 2023, after a 4-week oral lead-in phase. The eligibility criteria included viral suppression, absence of hepatitis B virus (HBV) DNA, and no prior RPV resistance mutations. Clinical data, including renal, lipid, and glucose biomarker levels, were monitored from the baseline to 44 weeks after switching. Treatment satisfaction was assessed using the HIV Treatment Satisfaction Questionnaire. A linear mixed-effects model was used to estimate changes in clinical data from baseline.
Thirty-eight male participants were enrolled. Some participants had detectable levels of viral replication; however, all participants maintained viral suppression (HIV-RNA < 50 copies/mL) at 44 weeks and no cases of virological failure were detected. The creatinine level decreased by - 0.04 mg/dL (95% confidence interval [CI]: - 0.07 to - 0.01), lipid and glucose profiles remained stable, and treatment satisfaction increased by 6.6 points (95% CI: 2.4 to 10.8) after switching to CAB + RPV.
Long-acting ART provides effective viral suppression and enhances treatment satisfaction in PLWH switching from conventional ART. Long-acting ART can improve patient well-being; however, patient selection and monitoring to prevent HBV-related complications are important.","Thirty-eight male participants were enrolled. Some participants had detectable levels of viral replication; however, all participants maintained viral suppression (HIV-RNA < 50 copies/mL) at 44 weeks and no cases of virological failure were detected. The creatinine level decreased by - 0.04 mg/dL (95% confidence interval [CI]: - 0.07 to - 0.01), lipid and glucose profiles remained stable, and treatment satisfaction increased by 6.6 points (95% CI: 2.4 to 10.8) after switching to CAB + RPV.","[{'lastname': 'Konishi', 'firstname': 'Keiji', 'initials': 'K', 'affiliation': 'Department of Infectious Diseases, Osaka City General Hospital, Osaka, Japan. konishi@hp-infect.med.osaka-u.ac.jp.\nDepartment of Post-Infectious Disease Therapeutics, Graduate School of Medicine, Osaka University, 2-2 Yamadaoka, Suita, Osaka, 565-0871, Japan. konishi@hp-infect.med.osaka-u.ac.jp.\nDepartment of Infection Control and Prevention, Graduate School of Medicine, Osaka University, Osaka, Japan. konishi@hp-infect.med.osaka-u.ac.jp.'}, {'lastname': 'Onozuka', 'firstname': 'Daisuke', 'initials': 'D', 'affiliation': 'Department of Post-Infectious Disease Therapeutics, Graduate School of Medicine, Osaka University, 2-2 Yamadaoka, Suita, Osaka, 565-0871, Japan.\nDepartment of Infection Control and Prevention, Graduate School of Medicine, Osaka University, Osaka, Japan.'}, {'lastname': 'Okubo', 'firstname': 'Moeka', 'initials': 'M', 'affiliation': 'Department of Pharmacy, Osaka City General Hospital, Osaka, Japan.'}, {'lastname': 'Kasamatsu', 'firstname': 'Yu', 'initials': 'Y', 'affiliation': 'Department of Infectious Diseases, Osaka City General Hospital, Osaka, Japan.'}, {'lastname': 'Kutsuna', 'firstname': 'Satoshi', 'initials': 'S', 'affiliation': 'Department of Post-Infectious Disease Therapeutics, Graduate School of Medicine, Osaka University, 2-2 Yamadaoka, Suita, Osaka, 565-0871, Japan.\nDepartment of Infection Control and Prevention, Graduate School of Medicine, Osaka University, Osaka, Japan.'}, {'lastname': 'Shirano', 'firstname': 'Michinori', 'initials': 'M', 'affiliation': 'Department of Infectious Diseases, Osaka City General Hospital, Osaka, Japan.'}]",Long-acting antiretroviral therapy effectiveness and patient satisfaction using patient questionnaires: data from a real-world setting.
"In China, the problem of HIV infection among the older people has become increasingly prominent. This study aimed to analyze the pattern and influencing factors of HIV transmission based on a genomic and spatial epidemiological analysis among this population.
A total of 432 older people who were aged ≥ 50 years, newly diagnosed with HIV-1 between January 2018 and December 2021 and without a history of ART were enrolled. HIV-1 pol gene sequence was obtained by viral RNA extraction and nested PCR. The molecular transmission network was constructed using HIV-TRACE and the spatial distribution analyses were performed in ArcGIS. The multivariate logistic regression analysis was performed to analyze the factors associated with clustering.
A total of 382 sequences were successfully sequenced, of which CRF07_BC (52.3%), CRF01_AE (32.5%), and CRF08_BC (6.8%) were the main HIV-1 strains. A total of 176 sequences entered the molecular network, with a clustering rate of 46.1%. Impressively, the clustering rate among older people infected through commercial heterosexual contact was as high as 61.7% and three female sex workers (FSWs) were observed in the network. The individuals who were aged ≥ 60 years and transmitted the virus by commercial heterosexual contact had a higher clustering rate, while those who were retirees or engaged other occupations and with higher education degree were less likely to cluster. There was a positive spatial correlation of clustering rate (Global Moran I = 0.206, P < 0.001) at the town level and the highly aggregated regions were mainly distributed in rural area. We determined three large clusters which mainly spread in the intra-region of certain towns in rural areas. Notably, 54.5% of cases in large clusters were transmitted through commercial heterosexual contact.
Our joint analysis of molecular and spatial epidemiology effectively revealed the spatial aggregation of HIV transmission and highlighted that towns of high aggregation were mainly located in rural area. Also, we found vital role of commercial heterosexual contact in HIV transmission among older people. Therefore, health resources should be directed towards highly aggregated rural areas and prevention strategy should take critical persons as entry points.","A total of 382 sequences were successfully sequenced, of which CRF07_BC (52.3%), CRF01_AE (32.5%), and CRF08_BC (6.8%) were the main HIV-1 strains. A total of 176 sequences entered the molecular network, with a clustering rate of 46.1%. Impressively, the clustering rate among older people infected through commercial heterosexual contact was as high as 61.7% and three female sex workers (FSWs) were observed in the network. The individuals who were aged ≥ 60 years and transmitted the virus by commercial heterosexual contact had a higher clustering rate, while those who were retirees or engaged other occupations and with higher education degree were less likely to cluster. There was a positive spatial correlation of clustering rate (Global Moran I = 0.206, P < 0.001) at the town level and the highly aggregated regions were mainly distributed in rural area. We determined three large clusters which mainly spread in the intra-region of certain towns in rural areas. Notably, 54.5% of cases in large clusters were transmitted through commercial heterosexual contact.","[{'lastname': 'Xu', 'firstname': 'Yuanyuan', 'initials': 'Y', 'affiliation': 'Department of AIDS/STD Control and Prevention, Nanjing Municipal Central for Disease Control and Prevention, Nanjing, 210003, China.'}, {'lastname': 'Jiang', 'firstname': 'Tingyi', 'initials': 'T', 'affiliation': 'School of Public Health, Nanjing Medical University, Nanjing, 211166, China.\nNanjing Center for Disease Control and Prevention Affiliated to Nanjing Medical University, Nanjing, 210003, China.'}, {'lastname': 'Jiang', 'firstname': 'Li', 'initials': 'L', 'affiliation': 'Department of Quality Management, Xiaoshan District Center for Disease Control and Prevention, Hangzhou, 311203, China.'}, {'lastname': 'Shi', 'firstname': 'Hongjie', 'initials': 'H', 'affiliation': 'Department of AIDS/STD Control and Prevention, Nanjing Municipal Central for Disease Control and Prevention, Nanjing, 210003, China.'}, {'lastname': 'Li', 'firstname': 'Xin', 'initials': 'X', 'affiliation': 'Department of AIDS/STD Control and Prevention, Nanjing Municipal Central for Disease Control and Prevention, Nanjing, 210003, China.'}, {'lastname': 'Qiao', 'firstname': 'Mengkai', 'initials': 'M', 'affiliation': 'Department of Microbiology Laboratory, Nanjing Municipal Central for Disease Control and Prevention, Nanjing, 210003, China.'}, {'lastname': 'Wu', 'firstname': 'Sushu', 'initials': 'S', 'affiliation': 'Department of AIDS/STD Control and Prevention, Nanjing Municipal Central for Disease Control and Prevention, Nanjing, 210003, China.'}, {'lastname': 'Wu', 'firstname': 'Rong', 'initials': 'R', 'affiliation': 'Department of AIDS/STD Control and Prevention, Nanjing Municipal Central for Disease Control and Prevention, Nanjing, 210003, China.'}, {'lastname': 'Yuan', 'firstname': 'Xin', 'initials': 'X', 'affiliation': 'Department of AIDS/STD Control and Prevention, Nanjing Municipal Central for Disease Control and Prevention, Nanjing, 210003, China.'}, {'lastname': 'Wang', 'firstname': 'Jingwen', 'initials': 'J', 'affiliation': 'Department of AIDS/STD Control and Prevention, Nanjing Municipal Central for Disease Control and Prevention, Nanjing, 210003, China.'}, {'lastname': 'Zhu', 'firstname': 'Zhengping', 'initials': 'Z', 'affiliation': 'Department of AIDS/STD Control and Prevention, Nanjing Municipal Central for Disease Control and Prevention, Nanjing, 210003, China. zzp@njcdc.cn.\nNanjing Center for Disease Control and Prevention Affiliated to Nanjing Medical University, Nanjing, 210003, China. zzp@njcdc.cn.'}]","Combining molecular transmission network analysis and spatial epidemiology to reveal HIV-1 transmission pattern among the older people in Nanjing, China."
"Tuberculosis constitutes a public health problem in Morocco. In an environment where results-based management and the evaluation of public policies become an imperative; the evaluation of the performance of the national tuberculosis control program finds its interest.
This study aims to analyze the performance of the tuberculosis control program in the Souss Massa region, based on the systemic approach model over a five-year period 2016-2020.
This is a descriptive secondary data analysis carried out in the Souss-Massa region in southern Morocco over a five year period 2016-2020. Data collection was carried out through the health information system of the NTCP and the various periodic reports produced by the primary health care establishments and diagnostic centers for tuberculosis and respiratory diseases, the delegations and the regional health directorate of the Ministry of Health.
The incidence of tuberculosis has fluctuated between 63 and 72 cases/100,000 inhabitants; the average number of cases detected is 1871 cases per year; the survey completion rate is 57.10%; the therapeutic success rate varies between 82% and 89%, the treatment failure rate varies between 0.62% and 2.32%; the death rate varies between 0.63% and 2.92%; the failure rate for tuberculosis/HIV cases is between 3.10% and 6.09%.
The results of the program tracer indicators at the level of the Souss-Massa region show that the latter combs to achieve the target objectives.","The incidence of tuberculosis has fluctuated between 63 and 72 cases/100,000 inhabitants; the average number of cases detected is 1871 cases per year; the survey completion rate is 57.10%; the therapeutic success rate varies between 82% and 89%, the treatment failure rate varies between 0.62% and 2.32%; the death rate varies between 0.63% and 2.92%; the failure rate for tuberculosis/HIV cases is between 3.10% and 6.09%.","[{'lastname': 'Boukar', 'firstname': 'S', 'initials': 'S', 'affiliation': 'National School of Applied Sciences, Ibn Zohr University, Laboratory of Health Sciences, Agadir, Morocco. Electronic address: slimane.boukar@edu.uiz.ac.ma.'}, {'lastname': 'Touaddi', 'firstname': 'A', 'initials': 'A', 'affiliation': 'National School of Applied Sciences, Ibn Zohr University, Laboratory of Health Sciences, Agadir, Morocco.'}, {'lastname': 'Lotfy', 'firstname': 'A', 'initials': 'A', 'affiliation': 'Regional Directorate of Health and Social Protection Souss Massa, Agadir, Morocco.'}, {'lastname': 'Lahlou', 'firstname': 'L', 'initials': 'L', 'affiliation': 'Ibn-Zohr University, Faculty of Medicine and Pharmacy, Agadir, Morocco.'}, {'lastname': 'Aaouini', 'firstname': 'H', 'initials': 'H', 'affiliation': 'National School of Applied Sciences, Ibn Zohr University, Laboratory of Health Sciences, Agadir, Morocco.'}, {'lastname': 'Moubachir', 'firstname': 'H', 'initials': 'H', 'affiliation': 'Ibn-Zohr University, Faculty of Medicine and Pharmacy, Agadir, Morocco.'}]","Performance evaluation of the national tuberculosis control program 2016-2020: Souss-Massa region, Morocco."
"Lesbian, gay, bisexual, transgender, queer and other (LGBTQ+) individuals face numerous health disparities, including higher rates of chronic diseases and sexually transmitted infections, partly due to marginalization, discrimination, and a healthcare system often unprepared to meet their specific needs. Despite the importance of vaccination in preventing these health issues, vaccination patterns in LGBTQ+ populations remain under-researched, with limited data available due to the absence of sexual orientation and gender identity information on most healthcare forms. As such, we sought to understand vaccine uptake among LGBTQ+ individuals living in New Jersey and New York for 7 primary adult vaccines.
Participants were 768 LGBTQ+ adults living in New Jersey and New York, US. We recruited this convenience sample through community centers and events, social media, and listservs of local professional organizations. The online survey examined uptake for 7 adult vaccines.
Of the 7 adult vaccines, human papilloma virus (HPV) had the lowest proportion of participants who were fully/partially vaccinated (54.4 %), followed by hepatitis A (59.8 %), hepatitis B (63.0 %), meningitis B (63.7 %), seasonal influenza during the COVID-19 pandemic (70.2 %), seasonal influenza before the COVID-19 pandemic (70.3 %), and nearly all participants (99.2 %) received at least one dose of the COVID-19 vaccine. For Shingles virus, among participants age 50+, 63.8 % were fully/partially vaccinated. In adjusted models, age was the strongest predictor of vaccination uptake in HPV, hepatitis A, hepatitis B, meningitis B, and seasonal influenza before and during the COVID-19 pandemic. Younger participants were more likely to be vaccinated for 4 of the 6 vaccines, excluding Shingles (<0.001), whereas older adults were more likely to be vaccinated for seasonal influenza before and during the COVID-19 pandemic (<0.010).
This study highlights the differences in uptake across different vaccines. It also draws attention to differences within LGBTQ+ populations which is important to consider when ensuring more equitable vaccine access.","Of the 7 adult vaccines, human papilloma virus (HPV) had the lowest proportion of participants who were fully/partially vaccinated (54.4 %), followed by hepatitis A (59.8 %), hepatitis B (63.0 %), meningitis B (63.7 %), seasonal influenza during the COVID-19 pandemic (70.2 %), seasonal influenza before the COVID-19 pandemic (70.3 %), and nearly all participants (99.2 %) received at least one dose of the COVID-19 vaccine. For Shingles virus, among participants age 50+, 63.8 % were fully/partially vaccinated. In adjusted models, age was the strongest predictor of vaccination uptake in HPV, hepatitis A, hepatitis B, meningitis B, and seasonal influenza before and during the COVID-19 pandemic. Younger participants were more likely to be vaccinated for 4 of the 6 vaccines, excluding Shingles (<0.001), whereas older adults were more likely to be vaccinated for seasonal influenza before and during the COVID-19 pandemic (<0.010).","[{'lastname': 'Krause', 'firstname': 'Kristen D', 'initials': 'KD', 'affiliation': 'Center for Health, Identity, Behavior, and Prevention Studies, School of Public Health (CHIBPS), Rutgers University, Newark, NJ, USA; Department of Urban-Global Health, School of Public Health, Rutgers University, Newark, NJ, USA. Electronic address: kristen.krause@rutgers.edu.'}, {'lastname': ""D'Avanzo"", 'firstname': 'Paul A', 'initials': 'PA', 'affiliation': 'Center for Health, Identity, Behavior, and Prevention Studies, School of Public Health (CHIBPS), Rutgers University, Newark, NJ, USA; HIV Center for Clinical and Behavioral Studies, Columbia University and the New York State Psychiatric Institute, New York, NY, USA.'}, {'lastname': 'Karr', 'firstname': 'Anita G', 'initials': 'AG', 'affiliation': 'Center for Health, Identity, Behavior, and Prevention Studies, School of Public Health (CHIBPS), Rutgers University, Newark, NJ, USA; Department of Epidemiology, Mailman School of Public Health, Columbia University, New York, NY, USA.'}, {'lastname': 'Rhem', 'firstname': 'Coree', 'initials': 'C', 'affiliation': 'Center for Health, Identity, Behavior, and Prevention Studies, School of Public Health (CHIBPS), Rutgers University, Newark, NJ, USA; Department of Biostatistics and Epidemiology, School of Public Health, Rutgers University, Piscataway, NJ, USA.'}, {'lastname': 'Halkitis', 'firstname': 'Perry N', 'initials': 'PN', 'affiliation': 'Center for Health, Identity, Behavior, and Prevention Studies, School of Public Health (CHIBPS), Rutgers University, Newark, NJ, USA; Department of Biostatistics and Epidemiology, School of Public Health, Rutgers University, Piscataway, NJ, USA.'}]",Vaccination uptake in LGBTQ adults in two US states: Findings from the QVax study.
"Tuberculosis (TB) is a leading cause of death in patients with human immunodeficiency virus (HIV)/AIDS. About 60% of HIV-positive individuals with latent TB infection (LTBI) develop active TB. Isoniazid preventive therapy (IPT) is recommended by the World Health Organization to prevent the progression of active TB in people living with HIV/AIDS (PLWHA). However, IPT implementation has been limited in some countries like Indonesia. The objective of this study was to assess the effect of IPT administration on the incidence of active TB in HIV patients with latent TB.
This was a quasi-experimental prospective cohort study conducted in an academic hospital in Indonesia. Interferon-gamma release assay-positive HIV-TB patients were randomly divided into an IPT group (received 6 months of IPT) and a non-IPT group. The incidence of active pulmonary TB was compared between the two groups after 6 months of follow-up.
Of the 23 eligible patients, 22 were enrolled (10 in the IPT group, 12 in the non-IPT group). The incidence of active pulmonary TB was 0% in both groups. Factors associated with the absence of TB in both groups were the use of antiretroviral therapy for >4 years and a CD4+ T lymphocyte count >200 cells/μL. IPT was found to be safe with minimal adverse effects.
In this setting, the use of long-term antiretroviral therapy and higher CD4+ counts, rather than just IPT, were the key factors associated with preventing active TB in latent HIV-TB patients. These findings suggest that comprehensive HIV management may be more important than IPT alone for TB control in PLWHA. Further research is needed to optimize TB prevention strategies in this high-risk population.","Of the 23 eligible patients, 22 were enrolled (10 in the IPT group, 12 in the non-IPT group). The incidence of active pulmonary TB was 0% in both groups. Factors associated with the absence of TB in both groups were the use of antiretroviral therapy for >4 years and a CD4+ T lymphocyte count >200 cells/μL. IPT was found to be safe with minimal adverse effects.","[{'lastname': 'Yuniati', 'firstname': 'Shinta Karina', 'initials': 'SK', 'affiliation': 'Faculty of Medicine, Universitas Pembangunan Nasional Veteran Jawa Timur, Surabaya, Indonesia.'}, {'lastname': 'Kusmiati', 'firstname': 'Tutik', 'initials': 'T', 'affiliation': 'Department of Pulmonology and Respiratory Medicine, Faculty of Medicine, Airlangga University, Surabaya, Indonesia.'}]","Factors Associated with Absence of Active Pulmonary Tuberculosis in HIV Patients with Latent Tuberculosis, Beyond Isoniazid Preventive Therapy."
"As people living with HIV experience increased life expectancy, there is a growing concern about the burden of comorbid non-communicable diseases, particularly hypertension. This brief describes the current policy landscape on the management of HIV and hypertension in Akwa Ibom State, Nigeria, stakeholder engagement meetings, and the resulting five policy recommendations rooted in an ongoing research study designed to integrate hypertension management into HIV care across primary health centers in the State. In order to identify the current gaps in integrated care, discussion sessions with three stakeholder groups (i.e., healthcare providers, patient advocacy groups, and policy makers) were held separately in November 2022. The discussions were purposed to brainstorm policy-level solutions for integrating hypertension into HIV treatment. After all the sessions were concluded, there were five recommendations provided by the stakeholders for integrating HIV and hypertension care in the Akwa Ibom State. Stakeholders unanimously agreed with the need to integrate hypertension care for HIV impacted communities in the State. Specifically, stakeholders recommended to: (1) engage retired community health nurses as mentors; (2) actively link communities to integrated care in clinics; (3) integrate hypertension management with HIV education; (4) expand health insurance accessibility; and (5) formally integrate hypertension management into primary healthcare centers in Akwa Ibom State.",,"[{'lastname': 'Mishra', 'firstname': 'Shivani', 'initials': 'S', 'affiliation': 'Institute for Excellence in Health Equity, NYU Grossman School of Medicine, New York, NY, USA.'}, {'lastname': 'Aifah', 'firstname': 'Angela A', 'initials': 'AA', 'affiliation': 'Institute for Excellence in Health Equity, NYU Grossman School of Medicine, New York, NY, USA. angela.aifah@nyulangone.org.\nSection for Global Health, Department of Population Health, NYU Grossman School of Medicine, New York, NY, USA. angela.aifah@nyulangone.org.'}, {'lastname': 'Henry', 'firstname': 'Daniel', 'initials': 'D', 'affiliation': 'Cardiovascular Research Unit, University of Abuja and University of Abuja Teaching Hospital, Gwagwalada, Abuja, Nigeria.'}, {'lastname': 'Uzoigwe', 'firstname': 'Nina', 'initials': 'N', 'affiliation': 'NYU Grossman School of Medicine, New York, NY, USA.'}, {'lastname': 'Udoh', 'firstname': 'Ememobong Bassey', 'initials': 'EB', 'affiliation': 'Cardiovascular Research Unit, University of Abuja and University of Abuja Teaching Hospital, Gwagwalada, Abuja, Nigeria.'}, {'lastname': 'Idang', 'firstname': 'Esther', 'initials': 'E', 'affiliation': 'Cardiovascular Research Unit, University of Abuja and University of Abuja Teaching Hospital, Gwagwalada, Abuja, Nigeria.'}, {'lastname': 'Munagala', 'firstname': 'Jahnavi', 'initials': 'J', 'affiliation': 'Institute for Excellence in Health Equity, NYU Grossman School of Medicine, New York, NY, USA.'}, {'lastname': 'Onakomaiya', 'firstname': 'Deborah', 'initials': 'D', 'affiliation': 'Institute for Excellence in Health Equity, NYU Grossman School of Medicine, New York, NY, USA.\nVilcek Institute of Graduate Biomedical Sciences, NYU Grossman School of Medicine, New York, NY, USA.'}, {'lastname': 'Kanneh', 'firstname': 'Nafesa', 'initials': 'N', 'affiliation': 'Institute for Excellence in Health Equity, NYU Grossman School of Medicine, New York, NY, USA.'}, {'lastname': 'Ekanem', 'firstname': 'Anyiekere', 'initials': 'A', 'affiliation': 'University of Uyo Teaching Hospital, Uyo, Akwa Ibom State, Nigeria.'}, {'lastname': 'Attah', 'firstname': 'Eno Angela', 'initials': 'EA', 'affiliation': 'Akwa Ibom State Primary Healthcare Development Agency, Uyo, Akwa Ibom State, Nigeria.'}, {'lastname': 'Ogedegbe', 'firstname': 'Gbenga', 'initials': 'G', 'affiliation': 'Institute for Excellence in Health Equity, NYU Grossman School of Medicine, New York, NY, USA.'}, {'lastname': 'Ojji', 'firstname': 'Dike', 'initials': 'D', 'affiliation': 'Cardiovascular Research Unit, University of Abuja and University of Abuja Teaching Hospital, Gwagwalada, Abuja, Nigeria.\nDepartment of Internal Medicine, Faculty of Clinical Sciences, University of Abuja, Gwagwalada, Abuja, Nigeria.'}]","Moving forward: scaling-up the integration of an HIV and hypertension program in Akwa Ibom State, Nigeria."
