abstract,results,authors,title
"After rapid epidemic growth between May and August, 2022, new mpox diagnoses declined in Europe and the Americas, with low-level transmission continuing thereafter. Characterising the extent of behavioural adaptation, mpox vaccination, and mpox prevalence across these regions could improve our understanding of the transmission dynamics of the virus. We aimed to characterise the presence and duration of adaptations to sexual behaviour related to the emergence of mpox during the first year of the outbreak among affected communities in Europe and the Americas.
This retrospective, cross-sectional online survey was conducted in 23 countries in Europe and the Americas between May 19 and May 31, 2023. The survey was advertised via four geospatial dating apps used by affected communities. Eligible participants were aged 18 years or older and identified as a gay man, a bisexual man, a man who has sex with men, as transgender, or as non-binary. We described and regionally compared the mpox prevalence, mpox vaccination rates (one dose or two doses of modified vaccinia virus Bavarian Nordic), and the extent and duration of behavioural adaptation during the outbreak. For these behavioural outcomes, we used regression analyses to estimate crude prevalence ratios (PRs) and adjusted prevalence ratios (aPRs) with 95% CIs.
Of 17 428 individuals who completed the survey, 16 875 (96·8%) met the eligibility criteria and were included in the study. 1086 (6·4%) participants reported having mpox during the outbreak. Vaccination with at least one dose was reported by 4987 (29·6%) participants; 3502 (20·8%) reported two doses. Vaccination rates in Latin America and eastern Europe and the western Balkans were significantly lower than in western Europe and northern America (p<0·0001). Adaptations to sexual behaviour were reported by 8583 (50·9%) of 16 875 participants and across all regions; 3045 (35·5%) of these 8583 participants said they continued adapting their sexual behaviour until May, 2023. Participants who reported concerns about mpox (9884 [58·6%] of 16 875) were more likely to adapt their behaviour than those who did not report concerns (PR 2·43 [95% CI 2·34-2·53]). In adjusted regression models, participants who reported vaccination (aPR 0·25 [95% CI 0·21-0·28] for two doses and 0·43 [0·37-0·51] for one dose) or having had mpox (0·37 [0·30-0·44]) were less likely to continue adaptations than those who did not. Participants in Latin America or northern America were significantly more likely to adapt their sexual behaviour and to continue with adaptations than those in western Europe.
Adaptations to sexual behaviour due to mpox were widespread, dynamic, and responded to evolving individual risk perceptions. We propose that the decline in mpox transmission seen at the end of 2022 resulted primarily from a combination of behavioural adaptation and naturally acquired immunity. As mpox vaccination is an important preventive measure, stark vaccine inequity highlights the need to increase access to mpox vaccines.
WHO Contingency Fund for Emergencies.",,"[{'lastname': 'Prochazka', 'firstname': 'Mateo', 'initials': 'M', 'affiliation': 'Global HIV, Hepatitis and Sexually Transmitted Infections Programmes, World Health Organization, Geneva, Switzerland. Electronic address: prochazkam@who.int.'}, {'lastname': 'Vinti', 'firstname': 'Pietro', 'initials': 'P', 'affiliation': 'Joint Infectious Diseases Unit, World Health Organization Regional Office for Europe, Copenhagen, Denmark.'}, {'lastname': 'Hoxha', 'firstname': 'Ana', 'initials': 'A', 'affiliation': 'Health Emergencies Programme, World Health Organization, Geneva, Switzerland.'}, {'lastname': 'Seale', 'firstname': 'Andy', 'initials': 'A', 'affiliation': 'Global HIV, Hepatitis and Sexually Transmitted Infections Programmes, World Health Organization, Geneva, Switzerland.'}, {'lastname': 'Mozalevskis', 'firstname': 'Antons', 'initials': 'A', 'affiliation': 'Global HIV, Hepatitis and Sexually Transmitted Infections Programmes, World Health Organization, Geneva, Switzerland.'}, {'lastname': 'Lewis', 'firstname': 'Rosamund', 'initials': 'R', 'affiliation': 'Health Emergencies Programme, World Health Organization, Geneva, Switzerland.'}, {'lastname': 'Sagastume', 'firstname': 'Ruben Mayorga', 'initials': 'RM', 'affiliation': 'HIV, Hepatitis, Tuberculosis, and Sexually Transmitted Infections Unit, Pan American Health Organization, Washington, DC, USA.'}, {'lastname': 'Scherzer', 'firstname': 'Martha', 'initials': 'M', 'affiliation': 'Behavioural and Cultural Insights Unit, World Health Organization Regional Office for Europe, Copenhagen, Denmark.'}, {'lastname': 'Dore', 'firstname': 'Leilia', 'initials': 'L', 'affiliation': 'Health Emergencies Programme, World Health Organization, Geneva, Switzerland.'}, {'lastname': 'Doherty', 'firstname': 'Meg', 'initials': 'M', 'affiliation': 'Global HIV, Hepatitis and Sexually Transmitted Infections Programmes, World Health Organization, Geneva, Switzerland.'}]",Temporary adaptations to sexual behaviour during the mpox outbreak in 23 countries in Europe and the Americas: findings from a retrospective cross-sectional online survey.
"To describe the practices and knowledge of Nursing Technicians and Community Health Agents of Primary Health Care for the transgender population.
Descriptive research with a qualitative approach. SITE: The study was developed in a digital environment.
18 Community Health Agents and 12 Nursing Technicians who worked in Primary Health Care Units from several Brazilian states.
Sampling technique by chain indication or networks (snowball), data production by Google Forms form. The theoretical saturation technique was used to close the interviews. Categorical thematic content analysis with IRAMUTEQ software support.
Professionals' lack of knowledge about policies and terms was evidenced; there were conceptual confusions, inadequate associations, and a restricted approach to the prevention of sexually transmitted infections.
The lack of training reflects a cisnormative and binary approach, compromising the assistance to the transgender population. Disrespect for the social name persists, highlighting the need for permanent education for health professionals, aiming at an inclusive and respectful care practice.","Professionals' lack of knowledge about policies and terms was evidenced; there were conceptual confusions, inadequate associations, and a restricted approach to the prevention of sexually transmitted infections.","[{'lastname': 'de Sousa', 'firstname': 'Francisco Jean Gomes', 'initials': 'FJG', 'affiliation': 'Universidade do Estado do Rio de Janeiro, Brazil. Electronic address: jeangomesips3@gmail.com.'}, {'lastname': 'Amatuzzi', 'firstname': 'Edgar', 'initials': 'E', 'affiliation': 'Universidade Federal do Estado do Rio de Janeiro, Brazil.'}, {'lastname': 'Nunciaroni', 'firstname': 'Andressa Teoli', 'initials': 'AT', 'affiliation': 'Universidade Federal do Estado do Rio de Janeiro, Brazil.'}, {'lastname': 'Caravaca-Morera', 'firstname': 'Jaime Alonso', 'initials': 'JA', 'affiliation': 'Universidade da Costa Rica, Brazil.'}, {'lastname': 'Ribeiro', 'firstname': 'Claudia Regina', 'initials': 'CR', 'affiliation': 'Universidade Federal Fluminense, Brazil.'}, {'lastname': 'Lemos', 'firstname': 'Adriana', 'initials': 'A', 'affiliation': 'Universidade Federal do Estado do Rio de Janeiro, Brazil.'}]",Practices and knowledge of health personnel about transgenderity in Primary Health Care.
,,"[{'lastname': 'Baloda', 'firstname': 'Vandana', 'initials': 'V', 'affiliation': 'University of Pittsburgh Medical Center.'}, {'lastname': 'Aggarwal', 'firstname': 'Nidhi', 'initials': 'N', 'affiliation': 'University of Pittsburgh School of Medicine.'}]",Secondary syphilis: first evidence of diagnosis on a lymph node biopsy.
"Bovine papillomatosis is an infectious viral disease of cattle characterized by development of benign cutaneous warts. The present study describes bovine papillomavirus infection in cattle on clinco-pathological and molecular bases and compares the identified strains with the previously characterized papillomavirus isolates in Egypt either of bovine or equine origin. Out of sixty examined cattle, skin lesions were collected from eleven clinically diseased cattle exhibiting typical papillomatosis clinical signs and subjected to histopathological and molecular identification. Histological sections showed well-developed papillary projections of squamous epithelium associated with fibrovascular stroma. Type 1 bovine papillomavirus (BPV-1) was identified in the cutaneous lesions based on the results of L1 gene-based PCR using degenerated primer followed by DNA sequencing. Comparative sequence and evolutionary analysis revealed that papilloma sequences (OP777901, OP777902, OP777903) obtained in the current study are clustered along with MW018705.1, MG547343.1isolated from cattle in Egypt in 2017/2018 and MT502095.1.1, and MT502105.1 isolated from equine in Egypt in 2019. Results prove the circulation of BPV-1 in the areas under investigation and shed light on the role of multispecies grazing in Egypt as a risk factor for transmission of BPV-1 from cattle to horses.",,"[{'lastname': 'Rouby', 'firstname': 'Sherin', 'initials': 'S', 'affiliation': 'Department of Veterinary Medicine, Faculty of Veterinary Medicine, Beni-Suef University, 62511, Egypt. shereen.rouby@vet.bsu.edu.eg.'}, {'lastname': 'Ewies', 'firstname': 'Samar', 'initials': 'S', 'affiliation': 'Department of Virology, Faculty of Veterinary Medicine, Beni-Suef University, Beni Suef 62511, Egypt.'}]",Bovine papillomavirus in Egypt: clinico-pathological features and molecular evolutionary analysis.
"In Northwest Territories (NWT), Canada, infection rates for chlamydia, gonorrhea, and syphilis are three to ten times higher than the national averages and have been steadily increasing. However, data are scarce on the socioeconomic, psychological, and behavioural factors associated with the proliferation of sexually transmitted infections (STIs) in NWT. To this extent, this study explores Indigenous mothers' perspectives on sexual health, STI risk factors and healthcare-seeking behaviours in NWT.
Quantitative and qualitative data were collected using a semi-structured questionnaire. Participants consisted of Indigenous mothers who were pregnant or had given birth within three years.
Of the 161 participants, with a mean age of 29.61 years, 70.81% lived with a partner, and 93.17% had given birth within the previous three years. Participants felt STIs were a concern (68.32%) and felt comfortable asking a male partner for safe sexual relations (67.70%). The healthcare system was the main source of STI information for most participants (83.85%). The main STI risk factors participants mentioned were young age, unsafe sexual relations, and substance use. Participants reported embarrassment, protecting personal and familial well-being, and confidentiality as factors affecting STI healthcare-seeking behaviour.
STIs result from an interaction between age, sexual behaviour, substance use, health literacy, and the historical and sociocultural contexts stigmatizing STIs and impacting women's abilities to demand safe sexual relations. Understanding these factors in a remote Indigenous context is vital to designing and implementing effective health and social interventions to reduce the prevalence of STIs in NWT.","Of the 161 participants, with a mean age of 29.61 years, 70.81% lived with a partner, and 93.17% had given birth within the previous three years. Participants felt STIs were a concern (68.32%) and felt comfortable asking a male partner for safe sexual relations (67.70%). The healthcare system was the main source of STI information for most participants (83.85%). The main STI risk factors participants mentioned were young age, unsafe sexual relations, and substance use. Participants reported embarrassment, protecting personal and familial well-being, and confidentiality as factors affecting STI healthcare-seeking behaviour.","[{'lastname': 'Kolahdooz', 'firstname': 'Fariba', 'initials': 'F', 'affiliation': 'Indigenous and Global Health Research Group, Division of Endocrinology and Metabolism, Department of Medicine, Faculty of Medicine & Dentistry, College of Health Sciences, Canada Research Chair in Population Health, University of Alberta, 1-126 Li Ka Shing Centre for Health Research Innovation, 112 Street, Edmonton, 8602, T6G 2E1, AB, Canada.'}, {'lastname': 'Zakkar', 'firstname': 'Moutasem', 'initials': 'M', 'affiliation': 'Indigenous and Global Health Research Group, Division of Endocrinology and Metabolism, Department of Medicine, Faculty of Medicine & Dentistry, College of Health Sciences, Canada Research Chair in Population Health, University of Alberta, 1-126 Li Ka Shing Centre for Health Research Innovation, 112 Street, Edmonton, 8602, T6G 2E1, AB, Canada.'}, {'lastname': 'Jang', 'firstname': 'Se Lim', 'initials': 'SL', 'affiliation': 'Indigenous and Global Health Research Group, Division of Endocrinology and Metabolism, Department of Medicine, Faculty of Medicine & Dentistry, College of Health Sciences, Canada Research Chair in Population Health, University of Alberta, 1-126 Li Ka Shing Centre for Health Research Innovation, 112 Street, Edmonton, 8602, T6G 2E1, AB, Canada.'}, {'lastname': 'Deck', 'firstname': 'Sarah', 'initials': 'S', 'affiliation': 'Indigenous and Global Health Research Group, Division of Endocrinology and Metabolism, Department of Medicine, Faculty of Medicine & Dentistry, College of Health Sciences, Canada Research Chair in Population Health, University of Alberta, 1-126 Li Ka Shing Centre for Health Research Innovation, 112 Street, Edmonton, 8602, T6G 2E1, AB, Canada.'}, {'lastname': 'Wagg', 'firstname': 'Adrain', 'initials': 'A', 'affiliation': 'Division of Geriatric Medicine, Department of Medicine, Faculty of Medicine & Dentistry, College of Health Sciences, University of Alberta, Edmonton, AB, Canada.'}, {'lastname': 'Corriveau', 'firstname': 'André', 'initials': 'A', 'affiliation': 'Independent public health consultant, Yellowknife, NT, Canada.'}, {'lastname': 'Kandola', 'firstname': 'Kami', 'initials': 'K', 'affiliation': 'Office of the Chief Public Health Officer, Department of Health and Social Services, Government of Northwest Territories, Yellowknife, NT, Canada.'}, {'lastname': 'Irlbacher-Fox', 'firstname': 'Stephanie', 'initials': 'S', 'affiliation': ""Hotıì ts'eeda Northwest Territories SPOR SUPPORT Unit, Yellowknife, NT, Canada.""}, {'lastname': 'Sharma', 'firstname': 'Sangita', 'initials': 'S', 'affiliation': 'Indigenous and Global Health Research Group, Division of Endocrinology and Metabolism, Department of Medicine, Faculty of Medicine & Dentistry, College of Health Sciences, Canada Research Chair in Population Health, University of Alberta, 1-126 Li Ka Shing Centre for Health Research Innovation, 112 Street, Edmonton, 8602, T6G 2E1, AB, Canada. gita.sharma@ualberta.ca.'}]","Indigenous Mothers' Perspective on Sexual Health in Northwest Territories, Canada: Results from the Maternal and Infant Health Project."
"Midlife, beginning at 40 years and extending to 65 years, a range that encompasses the late reproductive to late menopausal stages, is a unique time in women's lives, when hormonal and physical changes are often accompanied by psychological and social evolution. Access to sexual health and sexual well-being (SHSW) services, which include the prevention and management of sexually transmitted infections, contraception and the support of sexual function, pleasure and safety, is important for the health of midlife women, their relationships and community cohesion. The objective was to use the socio-ecological model to synthesise the barriers and enablers to SHSW services for midlife women in high-income countries. A systematic review of the enablers and barriers to women (including trans-gender and non-binary people) aged 40-65 years accessing SHSW services in high-income countries was undertaken. Four databases (PubMed, PsycINFO, Web of Science and Google Scholar) were searched for peer-reviewed publications. Findings were thematically extracted and reported in a narrative synthesis. Eighty-one studies were included; a minority specifically set out to study SHSW care for midlife women. The key barriers that emerged were the intersecting disadvantage of under-served groups, poor knowledge, about SHSW, and SHSW services, among women and their healthcare professionals (HCPs), and the over-arching effect of stigma, social connections and psychological factors on access to care. Enablers included intergenerational learning, interdisciplinary and one-stop women-only services, integration of SHSW into other services, peer support programmes, representation of minoritised midlife women working in SHSW, local and free facilities and financial incentives to access services for under-served groups. Efforts are needed to enhance education about SHSW and related services among midlife women and their healthcare providers. This increased education should be leveraged to improve research, public health messaging, interventions, policy development and access to comprehensive services, especially for midlife women from underserved groups.",,"[{'lastname': 'Simmons', 'firstname': 'Kiersten', 'initials': 'K', 'affiliation': 'Brighton and Sussex Medical School, and University Hospitals Sussex NHS Foundation Trust, Brighton, UK.'}, {'lastname': 'Llewellyn', 'firstname': 'Carrie', 'initials': 'C', 'affiliation': 'Department of Primary Care and Public Health, Brighton and Sussex Medical School, Brighton, UK.'}, {'lastname': 'Bremner', 'firstname': 'Stephen', 'initials': 'S', 'affiliation': 'Department of Primary Care and Public Health, Brighton and Sussex Medical School, Brighton, UK.'}, {'lastname': 'Gilleece', 'firstname': 'Yvonne', 'initials': 'Y', 'affiliation': 'Brighton and Sussex Medical School, and University Hospitals Sussex NHS Foundation Trust, Brighton, UK.'}, {'lastname': 'Norcross', 'firstname': 'Claire', 'initials': 'C', 'affiliation': 'London School of Hygiene and Tropical Medicine, London, UK.'}, {'lastname': 'Iwuji', 'firstname': 'Collins', 'initials': 'C', 'affiliation': 'Global Health and Infection Department, Brighton and Sussex Medical School and University Hospitals Sussex NHS Foundation Trust, Brighton, UK.\nAfrica Health Institute, KwaZulu-Natal, South Africa.'}]",The barriers and enablers to accessing sexual health and sexual well-being services for midlife women (aged 40-65 years) in high-income countries: A mixed-methods systematic review.
"Human papillomavirus (HPV) is responsible for the most common sexually transmitted infection, particularly among sexually active individuals. Understanding the geographical distribution and epidemiology of the most prevalent HPV genotypes is essential for developing effective prevention strategies. Consequently, this study aimed to examine the distribution of HPV genotypes among HPV-positive women and men in Sari, the capital city of Mazandaran province in northern Iran.
HPV DNA was extracted (PZP Company, Molecular IVD, Iran) from genital and cervical samples of the study participants. Genotyping was conducted for 90 cases utilizing the High + Low Papilloma Strip test (Operon Company, Spain). Demographic data were statistically analyzed in correlation with the virological data (STATA version 17).
Overall, 67.7% (61 out of 90) of the cases tested positive for HPV, with 75% of those being classified as high-risk. The participant group consisted of 92% females (83) and 8% males (7). The highest HPV prevalence, 75% (36), was observed in females and males aged under 31, with the majority of positive cases belonging to high-risk genotypes. The most frequently identified genotypes were HPV-11 (23%), HPV-6 (21%), HPV-56 (18%), HPV-39 (16%), HPV-16, HPV-91, and HPV-66 each comprising (14%). HPV-56 was the most common high-risk genotype, accounting for 11 cases (18%), followed by HPV-39, which was present in 10 cases (16%).
The prevalence of HPV infection was particularly high among individuals under the age of 31 for both genders, with men exhibiting a 100% infection rate. These findings emphasize the urgent need for targeted education aimed at the younger population and the implementation of infection control measures. Specifically, widespread HPV vaccination targeting HPV-6, HPV-11, HPV-39, and HPV-56 should be prioritized for the general population.","Overall, 67.7% (61 out of 90) of the cases tested positive for HPV, with 75% of those being classified as high-risk. The participant group consisted of 92% females (83) and 8% males (7). The highest HPV prevalence, 75% (36), was observed in females and males aged under 31, with the majority of positive cases belonging to high-risk genotypes. The most frequently identified genotypes were HPV-11 (23%), HPV-6 (21%), HPV-56 (18%), HPV-39 (16%), HPV-16, HPV-91, and HPV-66 each comprising (14%). HPV-56 was the most common high-risk genotype, accounting for 11 cases (18%), followed by HPV-39, which was present in 10 cases (16%).","[{'lastname': 'Letafati', 'firstname': 'Arash', 'initials': 'A', 'affiliation': 'Research Center for Clinical Virology, Tehran University of Medical Science, Tehran, Iran.\nDepartment of Virology, Faculty of Public Health, Tehran University of Medical Sciences, Tehran, Iran.'}, {'lastname': 'Farahani', 'firstname': 'Ali Vasheghani', 'initials': 'AV', 'affiliation': 'Research Center for Clinical Virology, Tehran University of Medical Science, Tehran, Iran.'}, {'lastname': 'Nasiri', 'firstname': 'Mohammad Mostafa Baradaran', 'initials': 'MMB', 'affiliation': 'Research Center for Clinical Virology, Tehran University of Medical Science, Tehran, Iran.'}, {'lastname': 'Pourmoein', 'firstname': 'Hossein', 'initials': 'H', 'affiliation': 'Research Center for Clinical Virology, Tehran University of Medical Science, Tehran, Iran.'}, {'lastname': 'Ardekani', 'firstname': 'Omid Salahi', 'initials': 'OS', 'affiliation': 'Research Center for Clinical Virology, Tehran University of Medical Science, Tehran, Iran.'}, {'lastname': 'Ahoodashty', 'firstname': 'Haniyeh', 'initials': 'H', 'affiliation': 'Research Center for Clinical Virology, Tehran University of Medical Science, Tehran, Iran.'}, {'lastname': 'Hashemi-Soteh', 'firstname': 'Mohammad Bagher', 'initials': 'MB', 'affiliation': 'Immunogenetic Research Center, Molecular and Cell Biology Research Center, Faculty of Medicine, Mzandaran University of Medical Sciences, Sari, Iran.'}, {'lastname': 'Dadgar', 'firstname': 'Aniseh', 'initials': 'A', 'affiliation': 'Research Center for Clinical Virology, Tehran University of Medical Science, Tehran, Iran.\nDepartment of Epidemiology and Biostatistics, School of Public Health, Tehran University of Medical Sciences, Tehran, Iran.'}, {'lastname': 'Behshood', 'firstname': 'Parisa', 'initials': 'P', 'affiliation': 'Department of Microbiology, Young Researchers and Elite Club, Shahrekord Branch, Islamic Azad University, Shahrekord, Iran.'}, {'lastname': 'Azhar', 'firstname': 'Iman Rezaee', 'initials': 'IR', 'affiliation': 'Research Center for Clinical Virology, Tehran University of Medical Science, Tehran, Iran.'}, {'lastname': 'Parsania', 'firstname': 'Masoud', 'initials': 'M', 'affiliation': 'Department of Microbiology, Faculty of Medicine, Tehran Medical Sciences, Islamic Azad University, Tehran, Iran. mparsania@iautmu.ac.ir.'}]","High prevalence of HPV-56 and HPV-39 in Sari, Iran: an analysis of genotype distribution."
